Ok. You carefully pour your bottle of highly flammable hair rejuvenator on the emergency exit's padlock. It makes the lock look really new!	Ok. You carefully pour your bottle of highly flammable hair rejuvenator on the emergency exit's padlock. It makes the lock look really new!
You try your best to jimmy the lock with the dull cheese knife, but for naught.	You try your best to jimmy the lock with the dull cheese knife, but for naught.
You don't have the proper equipment to do that.	You don't have the proper equipment to do that.
(You've heard that line before!)	(You've heard that line before!)
Cleverly, you insert the bobby pin into the safety lock. (Wouldn't you guess this is against some Federal regulation?)	Cleverly, you insert the bobby pin into the safety lock. (Wouldn't you guess this is against some Federal regulation?)
The pin works! The door is unlocked.	The pin works! The door is unlocked.
With great difficulty, you push the large red handle until you feel something tear. Crossing your legs, you shove the handle a quarter-turn to the left, until it is near the word "DANGER."	With great difficulty, you push the large red handle until you feel something tear. Crossing your legs, you shove the handle a quarter-turn to the left, until it is near the word "DANGER."
A heavy, locked padlock on the handle prevents you from doing that.	A heavy, locked padlock on the handle prevents you from doing that.
It IS!	It IS!
Some gal has been in that one for hours!	Some gal has been in that one for hours!
There's a large red handle preventing that.	There's a large red handle preventing that.
"Hey, buddy," you shout, "how's 'bout givin' me one of them coffin nails?"	"Hey, buddy," you shout, "how's 'bout givin' me one of them coffin nails?"
(Why, Larry! You don't even smoke!)	(Why, Larry! You don't even smoke!)
You give the door a firm shove...	You give the door a firm shove...
...and the blast of the airstream tears it from its hinges!	...and the blast of the airstream tears it from its hinges!
You feel yourself being sucked...	You feel yourself being sucked...
...out, unfortunately!	...out, unfortunately!
The view from this height is spectacular, but wobbly.	The view from this height is spectacular, but wobbly.
The view from this height is spectacular.	The view from this height is spectacular.
Again?	Again?
Good idea, Larry!	Good idea, Larry!
But you aren't wearing a parachute!	But you aren't wearing a parachute!
You valiently struggle with the balky straps. However even a macho stud like you is incapable of donning a parachute while plummeting through the atmosphere at terminal velocity.	You valiently struggle with the balky straps. However even a macho stud like you is incapable of donning a parachute while plummeting through the atmosphere at terminal velocity.
You don't seem to have one!	You don't seem to have one!
The blessed parachute blossoms above you, jerking you around a lot, a feeling not wholly unfamiliar to you!	The blessed parachute blossoms above you, jerking you around a lot, a feeling not wholly unfamiliar to you!
How you hope you will NOT land there!	How you hope you will NOT land there!
How you hope you will land there!	How you hope you will land there!
It appears to be approaching!	It appears to be approaching!
They appear to be receding!	They appear to be receding!
The view from this height is spectacular, but rather wobbly.	The view from this height is spectacular, but rather wobbly.
Larry, you must remember the old saying...	Larry, you must remember the old saying...
"Skydivers are good to the very last drop!"	"Skydivers are good to the very last drop!"
"It don't mean a thing, if you don't pull that string!"	"It don't mean a thing, if you don't pull that string!"
Unfortunately, you pulled a little too late to hit that island over there!	Unfortunately, you pulled a little too late to hit that island over there!
It's caught in the tree, and you're caught in it!	It's caught in the tree, and you're caught in it!
Now you're REALLY out on a limb!	Now you're REALLY out on a limb!
The ground is far below you, and you're stuck in a parachute you bought from a vending machine!	The ground is far below you, and you're stuck in a parachute you bought from a vending machine!
"Doobee doobee do."	"Doobee doobee do."
You try your best, but the parachute harness' buckles are jammed.	You try your best, but the parachute harness' buckles are jammed.
You try, but the parachute harness holds you safely in place.	You try, but the parachute harness holds you safely in place.
A good idea...	A good idea...
But, with what?	But, with what?
Struggling to free yourself from the parachute harness, you realize the buckles are hopelessly jammed!	Struggling to free yourself from the parachute harness, you realize the buckles are hopelessly jammed!
Try as you might, you are unable to fix them, or free yourself.	Try as you might, you are unable to fix them, or free yourself.
Although you often have fun by just hanging around, this time you'd prefer to cut yourself down.	Although you often have fun by just hanging around, this time you'd prefer to cut yourself down.
That's what you get for buying a parachute from a vending machine!	That's what you get for buying a parachute from a vending machine!
You saw away at the parachute harness with the dull cheese knife, eventually turning it into a mere thread supporting your entire body weight. Suddenly, you look down, and consider the consequences of falling to the jungle floor from this height!	You saw away at the parachute harness with the dull cheese knife, eventually turning it into a mere thread supporting your entire body weight. Suddenly, you look down, and consider the consequences of falling to the jungle floor from this height!
But you don't consider it for long...	But you don't consider it for long...
The jungle floor is shrouded in darkness and covered with a viscous substance that you presume passes for dirt around here.	The jungle floor is shrouded in darkness and covered with a viscous substance that you presume passes for dirt around here.
There is a stout stick lying under the tree. You feel fortunate you did not land on it!	There is a stout stick lying under the tree. You feel fortunate you did not land on it!
There might be a way out of here near that bush.	There might be a way out of here near that bush.
It looks like a prehistoric Al Lowe!	It looks like a prehistoric Al Lowe!
There are some bees resting on that bush over there.	There are some bees resting on that bush over there.
The swarm of bees are just resting on a branch of a bush. You remember reading something about a new strain of bees from this area.	The swarm of bees are just resting on a branch of a bush. You remember reading something about a new strain of bees from this area.
It's like a jungle in here.	It's like a jungle in here.
Could that be because you're stranded in the middle of a jungle on a tropical island?!	Could that be because you're stranded in the middle of a jungle on a tropical island?!
The ground here is unusually spongy.	The ground here is unusually spongy.
You can never tell when a nice, stout stick like this one will come in handy!	You can never tell when a nice, stout stick like this one will come in handy!
You must be joking!	You must be joking!
That wouldn't help.	That wouldn't help.
Jumping won't help you now.	Jumping won't help you now.
But first, move a little closer to the bush.	But first, move a little closer to the bush.
The trees can't help you here.	The trees can't help you here.
Nah, you'd just wind up out on a limb again!	Nah, you'd just wind up out on a limb again!
That won't help here.	That won't help here.
Unghhh!	Unghhh!
A fall like that would be enough to break the average man's onklunk! Careful examination of yours reveals severe damage: the delicate instrument was smashed by the fall! You discard it here without learning of its dangerous cargo, nor realizing you have inadvertently kept the world's most valuable secret from falling into enemy hands!	A fall like that would be enough to break the average man's onklunk! Careful examination of yours reveals severe damage: the delicate instrument was smashed by the fall! You discard it here without learning of its dangerous cargo, nor realizing you have inadvertently kept the world's most valuable secret from falling into enemy hands!
Oops! You just brushed a bush containing a resting swarm of killer bees. You are frozen in fear! Could the rumors of their incredible strength really be true?	Oops! You just brushed a bush containing a resting swarm of killer bees. You are frozen in fear! Could the rumors of their incredible strength really be true?
Yep.	Yep.
Perhaps you'll enjoy your new life as the Queen Bee's personal love slave...	Perhaps you'll enjoy your new life as the Queen Bee's personal love slave...
...nah. No way!	...nah. No way!
You carefully lower yourself to the slimy ground and attempt to make your way past the dangerous swarm of killer bees!	You carefully lower yourself to the slimy ground and attempt to make your way past the dangerous swarm of killer bees!
You made it. Again!	You made it. Again!
You successfully avoid the dangerous killer bees.	You successfully avoid the dangerous killer bees.
Once again, you lower yourself to the jungle floor and hope you can slide your way below the dangerous swarm of killer bees!	Once again, you lower yourself to the jungle floor and hope you can slide your way below the dangerous swarm of killer bees!
He walks!	He walks!
He talks!	He talks!
He wriggles on his belly like a reptile!	He wriggles on his belly like a reptile!
You carefully prepare yourself for the oncoming jaws with the stick. Will it work?	You carefully prepare yourself for the oncoming jaws with the stick. Will it work?
A good idea, but this is not the place.	A good idea, but this is not the place.
You're close, but the stick is not heavy enough to harm the anaconda.	You're close, but the stick is not heavy enough to harm the anaconda.
You are mad enough to do that, but that's not the solution to your predicament.	You are mad enough to do that, but that's not the solution to your predicament.
Good idea, but that would just give the snake even more advantage. Just stick to using your brain.	Good idea, but that would just give the snake even more advantage. Just stick to using your brain.
There are no more snakes around.	There are no more snakes around.
There may be some movement in that center bush.	There may be some movement in that center bush.
This part of the jungle floor seems even more soft and mushy.	This part of the jungle floor seems even more soft and mushy.
It looks like a prehistoric punk rocker!	It looks like a prehistoric punk rocker!
There are no more snakes in this area.	There are no more snakes in this area.
A giant anaconda lies waiting for you, coiled around a branch directly above the only exit from this part of the jungle.	A giant anaconda lies waiting for you, coiled around a branch directly above the only exit from this part of the jungle.
The jungle is dense and dark. High above you, monkeys dance through the treetops.	The jungle is dense and dark. High above you, monkeys dance through the treetops.
A snake is in the process of devouring you!	A snake is in the process of devouring you!
You just attracted the attention of that giant anaconda by walking beneath his waiting coils. Perhaps if you hold very still he won't notice you!	You just attracted the attention of that giant anaconda by walking beneath his waiting coils. Perhaps if you hold very still he won't notice you!
Ok, so he DID notice you! Perhaps he just finished a big meal and couldn't eat another bite!	Ok, so he DID notice you! Perhaps he just finished a big meal and couldn't eat another bite!
Then again, perhaps he relishes the taste of polyester!	Then again, perhaps he relishes the taste of polyester!
You feel you could have eventually escaped his coils if there was only some way to keep him from swallowing you.	You feel you could have eventually escaped his coils if there was only some way to keep him from swallowing you.
As the snake dislocates its lower jaw in preparation for another hearty, cholesterol-laden dinner of red meat and polyester, you carefully insert your stick into the distended opening!	As the snake dislocates its lower jaw in preparation for another hearty, cholesterol-laden dinner of red meat and polyester, you carefully insert your stick into the distended opening!
The snake, unable to remove the stick from its jaws and embarrassed by being humiliated before the other jungle creatures, slithers away through the undergrowth to its lair (and an early retirement).	The snake, unable to remove the stick from its jaws and embarrassed by being humiliated before the other jungle creatures, slithers away through the undergrowth to its lair (and an early retirement).
You made it!	You made it!
The vines here are too high for you to reach.	The vines here are too high for you to reach.
That won't help you here.	That won't help you here.
The rocks are not the path to your success.	The rocks are not the path to your success.
Funny. He has no trouble whatsoever walking across this area.	Funny. He has no trouble whatsoever walking across this area.
The trees here can't help you. You're going to have to plod through this one on your own.	The trees here can't help you. You're going to have to plod through this one on your own.
The patterned area looks different from the rest of the ground here.	The patterned area looks different from the rest of the ground here.
It looks prepared to suck.	It looks prepared to suck.
The ground here has a strange pattern to it.	The ground here has a strange pattern to it.
The jungle floor is soft and sticky here.	The jungle floor is soft and sticky here.
(You fondly recall your first car's seat covers.)	(You fondly recall your first car's seat covers.)
At least this quicksand is nice and soft.	At least this quicksand is nice and soft.
Once again, you're in over your head, Larry!	Once again, you're in over your head, Larry!
In the future, you must be more observant!	In the future, you must be more observant!
The bank here is too steep and slippery for you to climb out.	The bank here is too steep and slippery for you to climb out.
Don't go that way, Larry! There's no game over there!!	Don't go that way, Larry! There's no game over there!!
The ocean appears to be just beyond that clump of trees near the beach.	The ocean appears to be just beyond that clump of trees near the beach.
A swift river cascades down from the island's volcano behind the jungle, splashing its way over some extremely dangerous rapids before becoming more placid and tranquil here in the jungle.	A swift river cascades down from the island's volcano behind the jungle, splashing its way over some extremely dangerous rapids before becoming more placid and tranquil here in the jungle.
You can only see a few vague shapes from here.	You can only see a few vague shapes from here.
They are presently feasting. Looks like dinner is on you, Larry!	They are presently feasting. Looks like dinner is on you, Larry!
Many vines hang down from the jungle canopy overhead.	Many vines hang down from the jungle canopy overhead.
One in particular attracts your eye: although it appears sturdy, it has been weakened near its top by excessive swinging!	One in particular attracts your eye: although it appears sturdy, it has been weakened near its top by excessive swinging!
The slippery rocks are far too treacherous for you to traverse.	The slippery rocks are far too treacherous for you to traverse.
A quiet brook babbles nearby. Vines hang from the jungle canopy, which thins as it reaches the beach just visible ahead.	A quiet brook babbles nearby. Vines hang from the jungle canopy, which thins as it reaches the beach just visible ahead.
All the other vines are out of your reach.	All the other vines are out of your reach.
You tug as hard as you can, but this vine is securely attached to that big branch above you.	You tug as hard as you can, but this vine is securely attached to that big branch above you.
You reach up, grasp the vine firmly, and give it a sharp jerk, yanking it from the tree branch above you!	You reach up, grasp the vine firmly, and give it a sharp jerk, yanking it from the tree branch above you!
You carefully coil it up and insert it into your left front pants pocket.	You carefully coil it up and insert it into your left front pants pocket.
Not in that water!	Not in that water!
The bank is too steep and too slippery here. Keep looking for a spot.	The bank is too steep and too slippery here. Keep looking for a spot.
The rocks are too slippery and steep for you to climb.	The rocks are too slippery and steep for you to climb.
You feel a tickling sensation around your toes. Boy, this adventuring life is sure fun!	You feel a tickling sensation around your toes. Boy, this adventuring life is sure fun!
This seems a safe place to climb out.	This seems a safe place to climb out.
Gee. Those piranha really work fast!	Gee. Those piranha really work fast!
For some reason, your heart just isn't in the game any more...	For some reason, your heart just isn't in the game any more...
...not to mention several other organs!	...not to mention several other organs!
Next time, you may want to consider using the next vine as well!	Next time, you may want to consider using the next vine as well!
Next time, you may want to grab that third vine!	Next time, you may want to grab that third vine!
Next time, you may want to release the third vine when you believe your trajectory will carry you safely over land!	Next time, you may want to release the third vine when you believe your trajectory will carry you safely over land!
(You knew all along you were a swinger!)	(You knew all along you were a swinger!)
You have no desire to return to the ocean after all you went through on that lifeboat, Larry!	You have no desire to return to the ocean after all you went through on that lifeboat, Larry!
The spectacular lagoon is crystal clear.	The spectacular lagoon is crystal clear.
Too bad you didn't bring that swimming suit!	Too bad you didn't bring that swimming suit!
In the distance you see the island's volcano ringed by a glacier, not at the top as you'd expect, but near the bottom of some vertical cliffs.	In the distance you see the island's volcano ringed by a glacier, not at the top as you'd expect, but near the bottom of some vertical cliffs.
But here a beautiful, tropical beach wraps its glorious splendor around a crystalline lagoon. What a wonderful place to vacation!	But here a beautiful, tropical beach wraps its glorious splendor around a crystalline lagoon. What a wonderful place to vacation!
(You wonder why it isn't covered with lots of cheap motels?!)	(You wonder why it isn't covered with lots of cheap motels?!)
This sandy beach is beautiful.	This sandy beach is beautiful.
You bend over and scoop up a large handful of beach sand and put it in your pockets.	You bend over and scoop up a large handful of beach sand and put it in your pockets.
(At last your pants are bulging!)	(At last your pants are bulging!)
Larry, look! Out in the surf! That beautiful native girl is waving at you, and...	Larry, look! Out in the surf! That beautiful native girl is waving at you, and...
  SHE'S TOPLESS!!  	  SHE'S TOPLESS!!  
"Gee," you think to yourself, "I thought girls like that only existed in 'National Geographic!'"	"Gee," you think to yourself, "I thought girls like that only existed in 'National Geographic!'"
It's love at first sight.	It's love at first sight.
(And also, second sight!)	(And also, second sight!)
You think, "This is the girl I've dreamed of; the woman I've longed for; the moment I've waited for! Is this the love I've been looking for?"	You think, "This is the girl I've dreamed of; the woman I've longed for; the moment I've waited for! Is this the love I've been looking for?"
Well, Larry? Are you just going to stand there? You've finally met the girl of your dreams, now's the time to take some action!	Well, Larry? Are you just going to stand there? You've finally met the girl of your dreams, now's the time to take some action!
You're limp. You've never been kissed like that before! Could it be? Is "Leisure Suit Larry" in love?	You're limp. You've never been kissed like that before! Could it be? Is "Leisure Suit Larry" in love?
(Again?)	(Again?)
You recover enough to speak, "Ohmigosh, you're beautiful! You're wonderful! Do you understand English? What's your name? Where are you from? Are you busy tonight?"	You recover enough to speak, "Ohmigosh, you're beautiful! You're wonderful! Do you understand English? What's your name? Where are you from? Are you busy tonight?"
"Of course I understand English, you silly; all of us here on Nontoonyt Island do. We live in a small village just off the beach. My name is Kalalau; what's yours?"	"Of course I understand English, you silly; all of us here on Nontoonyt Island do. We live in a small village just off the beach. My name is Kalalau; what's yours?"
"Of course; it only stands to reason that such a lovely man would also have such a lovely name," Kalalau's smile beams, melting your heart. "But, as to your question concerning my availability tonight, I am afraid I have disappointing information for you: as enjoyable as I feel sure an evening with someone like you must be, customs here on the island forbid pre-marital dating. On Nontoonyt Island, all women save themselves for marriage."	"Of course; it only stands to reason that such a lovely man would also have such a lovely name," Kalalau's smile beams, melting your heart. "But, as to your question concerning my availability tonight, I am afraid I have disappointing information for you: as enjoyable as I feel sure an evening with someone like you must be, customs here on the island forbid pre-marital dating. On Nontoonyt Island, all women save themselves for marriage."
"Well, that's ok," you volunteer, "why don't we just get married instead!"	"Well, that's ok," you volunteer, "why don't we just get married instead!"
She smiles in agreement, "Wouldn't that be wonderful! But, unfortunately our tribal elders have forbidden any new marriages until our island has been freed from its present scourge. Please permit me to elucidate: recently an abhorrent man took our island from us. He claimed our sacred ancestral burial grounds at the top of our volcano, and refuses to allow us to visit."	She smiles in agreement, "Wouldn't that be wonderful! But, unfortunately our tribal elders have forbidden any new marriages until our island has been freed from its present scourge. Please permit me to elucidate: recently an abhorrent man took our island from us. He claimed our sacred ancestral burial grounds at the top of our volcano, and refuses to allow us to visit."
She continues, "Soon thereafter, our perpetually blue skies turned to fog. While none of us had ever seen snow or ice, suddenly a glacier appeared on the slopes of the volcano, preventing our passage to our sacred lands. A treacherous river then appeared, gouging a formidable canyon just behind our village. Then (most odious of all) he hypnotized our most beautiful women, enslaving them in his mountaintop fortress, forcing them to do his every whim, no matter how sick or repulsive."	She continues, "Soon thereafter, our perpetually blue skies turned to fog. While none of us had ever seen snow or ice, suddenly a glacier appeared on the slopes of the volcano, preventing our passage to our sacred lands. A treacherous river then appeared, gouging a formidable canyon just behind our village. Then (most odious of all) he hypnotized our most beautiful women, enslaving them in his mountaintop fortress, forcing them to do his every whim, no matter how sick or repulsive."
"What a drag!" you sympathize.	"What a drag!" you sympathize.
"Yes," she agrees, "but now, the worst of all: because of all this, he prevented my people from completing a megabuck deal with a large, multi-national hotel conglomerate who were prepared to turn this place into next year's trendiest tourist trap! We had it bagged: they were going to build a huge, casino/resort/hotel complex right here on this lagoon, provide employment for our lazy men in the growing field of slot-machine repair, and even fund a day-care center so, (even though we women would continue to work our normal, 16-hour days in the taro patches) at least we wouldn't have to carry our children on our backs!"	"Yes," she agrees, "but now, the worst of all: because of all this, he prevented my people from completing a megabuck deal with a large, multi-national hotel conglomerate who were prepared to turn this place into next year's trendiest tourist trap! We had it bagged: they were going to build a huge, casino/resort/hotel complex right here on this lagoon, provide employment for our lazy men in the growing field of slot-machine repair, and even fund a day-care center so, (even though we women would continue to work our normal, 16-hour days in the taro patches) at least we wouldn't have to carry our children on our backs!"
"But did it happen? Hell, NO! And all because of that evil Dr. Nonookee!" she cries, suddenly turning quite sensitive. "Oh, if only some great hero could rid this island of his evilness, we could all live here happily ever after!"	"But did it happen? Hell, NO! And all because of that evil Dr. Nonookee!" she cries, suddenly turning quite sensitive. "Oh, if only some great hero could rid this island of his evilness, we could all live here happily ever after!"
