"Isn't polyester comfortable?"	"Isn't polyester comfortable?"
"Are you new around here, good lookin'?"	"Are you new around here, good lookin'?"
(Was that naked woman talking to you?)	(Was that naked woman talking to you?)
"Well, hello yourself, big boy," says the totally naked woman lying on the rock. "Aren't you the overdressed one? Say, since you're all dressed and I was just thinking of leaving, why don't we go to my place together. I know a wonderful spot near here where we can be alone. Come on, Larry, just follow me!"	"Well, hello yourself, big boy," says the totally naked woman lying on the rock. "Aren't you the overdressed one? Say, since you're all dressed and I was just thinking of leaving, why don't we go to my place together. I know a wonderful spot near here where we can be alone. Come on, Larry, just follow me!"
"Well, Tiger? What are you waiting for? Follow me!"	"Well, Tiger? What are you waiting for? Follow me!"
"C'mon Larry; let's go to my vehicle!"	"C'mon Larry; let's go to my vehicle!"
It looks as though they are all unoccupied.	It looks as though they are all unoccupied.
You are on the beach of a beautiful resort hotel, a tropical paradise for the rich and famous. In the distance you see people enjoying water sports of all kinds.	You are on the beach of a beautiful resort hotel, a tropical paradise for the rich and famous. In the distance you see people enjoying water sports of all kinds.
Hey, Larry! That's you out there in the surf!	Hey, Larry! That's you out there in the surf!
"LAND HO!!" you cry.	"LAND HO!!" you cry.
Oh, good; here comes someone to help you.	Oh, good; here comes someone to help you.
(Asshole!)	(Asshole!)
Congratulations, Larry! You have survived weeks adrift on the high seas with nothing but your courage, perseverance and a few humble provisions; endured tropical storms, vicious winds and high seas in just a tiny lifeboat; prevailed over the surf, off-shore barrier reef, and razor-sharp coral; escaped the dangerous Mother; avoided the vicious KGB and the tempting enticements of the evil Dr. Nonookee's henchette hordes, and withstood that creep's audacious humor...	Congratulations, Larry! You have survived weeks adrift on the high seas with nothing but your courage, perseverance and a few humble provisions; endured tropical storms, vicious winds and high seas in just a tiny lifeboat; prevailed over the surf, off-shore barrier reef, and razor-sharp coral; escaped the dangerous Mother; avoided the vicious KGB and the tempting enticements of the evil Dr. Nonookee's henchette hordes, and withstood that creep's audacious humor...
...and you're still as good as new!	...and you're still as good as new!
(But boy, is your suit a mess!!)	(But boy, is your suit a mess!!)
(Don't you just love a good polyester?)	(Don't you just love a good polyester?)
But now you wonder, "Where am I?"	But now you wonder, "Where am I?"
And what possessions survived your disastrous journey?	And what possessions survived your disastrous journey?
You stick your head under the table nearest you.	You stick your head under the table nearest you.
(You see nothing you wish to share at this time!)	(You see nothing you wish to share at this time!)
Why look! There's a knife lying next to the cheese plate.	Why look! There's a knife lying next to the cheese plate.
There's nothing left but food.	There's nothing left but food.
Your table conveniently arrived with food attached!	Your table conveniently arrived with food attached!
It's not much, but it's yours!	It's not much, but it's yours!
They aren't crowded! Perhaps you should talk to the Maitre d' about dining here.	They aren't crowded! Perhaps you should talk to the Maitre d' about dining here.
There are people sitting at the tables.	There are people sitting at the tables.
It's a nice chair.	It's a nice chair.
There's no one here except that snooty Maitre d'.	There's no one here except that snooty Maitre d'.
They make a lovely couple.	They make a lovely couple.
They certainly sit still!	They certainly sit still!
And, what a dress code!!	And, what a dress code!!
Nothing is too expensive for this place.	Nothing is too expensive for this place.
Expensive linen, crystal and silver weigh down the tables. An appetizer buffet fills one corner.	Expensive linen, crystal and silver weigh down the tables. An appetizer buffet fills one corner.
It's just hanging around.	It's just hanging around.
"No one at this table is interested in speaking with you."	"No one at this table is interested in speaking with you."
The Maitre d' stops you by growling angrily, "Sir! Our strict dress code forbids us serving anyone that looks like you! Please leave -- NOW!"	The Maitre d' stops you by growling angrily, "Sir! Our strict dress code forbids us serving anyone that looks like you! Please leave -- NOW!"
"We have a limit of one TV tray of food per customer," says the Maitre d' snootily. "Please leave... NOW!"	"We have a limit of one TV tray of food per customer," says the Maitre d' snootily. "Please leave... NOW!"
Wait until the maitre d' returns to his position.	Wait until the maitre d' returns to his position.
"Uh, excuse me, sir," you say hesitantly, "I was wondering if I might get a bite to eat?"	"Uh, excuse me, sir," you say hesitantly, "I was wondering if I might get a bite to eat?"
The Maitre d' slowly diverts his gaze toward you.	The Maitre d' slowly diverts his gaze toward you.
"Certainly not!" he sputters, "appropriate dress is always required here!"	"Certainly not!" he sputters, "appropriate dress is always required here!"
"Your name, please?" he asks.	"Your name, please?" he asks.
"Well, I suppose I could try to find a place for you on our busy schedule," he replies disdainfully. "Just have a seat there in the chair while I prepare a table for you."	"Well, I suppose I could try to find a place for you on our busy schedule," he replies disdainfully. "Just have a seat there in the chair while I prepare a table for you."
Grabbing the knife lying beside the cheese platter, you carve yourself off a huge hunk of cheddar and pop it into your mouth.	Grabbing the knife lying beside the cheese platter, you carve yourself off a huge hunk of cheddar and pop it into your mouth.
Not bad.	Not bad.
You glom up a cracker full of brie, and slip it into your mouth.	You glom up a cracker full of brie, and slip it into your mouth.
You've never liked brie.	You've never liked brie.
You reach over to your table, and grab a handful of oyster crackers, popping them into your mouth. (You've loved these things ever since you were a kid!)	You reach over to your table, and grab a handful of oyster crackers, popping them into your mouth. (You've loved these things ever since you were a kid!)
A good idea. Perhaps you should talk to the Maitre d'.	A good idea. Perhaps you should talk to the Maitre d'.
There's nothing nearby to eat.	There's nothing nearby to eat.
The Maitre d' DID say to help yourself to the buffet, but this is rather borderline behavior, Larry!	The Maitre d' DID say to help yourself to the buffet, but this is rather borderline behavior, Larry!
Oh, ok; you surreptitiously slip the slicer from the serving surface and sequester it in your suit.	Oh, ok; you surreptitiously slip the slicer from the serving surface and sequester it in your suit.
The Maitre d' stops you by growling angrily, "Sir! Our strict dress code forbids us serving anyone that looks like you! Please leave... NOW!"	The Maitre d' stops you by growling angrily, "Sir! Our strict dress code forbids us serving anyone that looks like you! Please leave... NOW!"
Please move between the table and chair if you want to sit down at your table.	Please move between the table and chair if you want to sit down at your table.
Perhaps you should talk to the man at the podium first.	Perhaps you should talk to the man at the podium first.
"Here's a hundred dollars," you inform the Maitre d'. "May I please have a nice table and something to eat?"	"Here's a hundred dollars," you inform the Maitre d'. "May I please have a nice table and something to eat?"
"Thank you, Sir. Just have a seat in the chair."	"Thank you, Sir. Just have a seat in the chair."
That Grotesque Gulp was enough to quench your thirst for the rest of this game!	That Grotesque Gulp was enough to quench your thirst for the rest of this game!
"Why, Mr. and Mrs. Rich," says the Maitre d'. "What a pleasure to see you again. Of course I have a table for you!"	"Why, Mr. and Mrs. Rich," says the Maitre d'. "What a pleasure to see you again. Of course I have a table for you!"
Well, that was certainly rude! You were here before them. You feel yourself becoming perturbed!	Well, that was certainly rude! You were here before them. You feel yourself becoming perturbed!
"I hope you find this satisfactory, Sir," grovels the Maitre d' with his palm extended.	"I hope you find this satisfactory, Sir," grovels the Maitre d' with his palm extended.
"Why, Mr. and Mrs. Famous," says the Maitre d'. "What a pleasure to see you again. Of course I have a table for you!"	"Why, Mr. and Mrs. Famous," says the Maitre d'. "What a pleasure to see you again. Of course I have a table for you!"
Well, that was certainly rude! You were here before them. You feel yourself becoming annoyed!	Well, that was certainly rude! You were here before them. You feel yourself becoming annoyed!
"Why, Mr. and Mrs. Gates," says the Maitre d'. "What a pleasure to see you again. Of course I have a table for you!"	"Why, Mr. and Mrs. Gates," says the Maitre d'. "What a pleasure to see you again. Of course I have a table for you!"
Well, that was certainly rude! You were here before them. You feel yourself becoming indignant!	Well, that was certainly rude! You were here before them. You feel yourself becoming indignant!
"Why, Mr. Leach," says the Maitre d'. "What a pleasure to see you again. Of course I have a table for you!"	"Why, Mr. Leach," says the Maitre d'. "What a pleasure to see you again. Of course I have a table for you!"
Well, that was certainly rude! You were here before them. You feel yourself becoming incensed!	Well, that was certainly rude! You were here before them. You feel yourself becoming incensed!
"Why, Mr. and Mrs. Williams," says the Maitre d'. "What a pleasure to see you again. Of course I have a table for you!"	"Why, Mr. and Mrs. Williams," says the Maitre d'. "What a pleasure to see you again. Of course I have a table for you!"
Well, that was certainly rude! You were here before them. You feel yourself becoming enraged!	Well, that was certainly rude! You were here before them. You feel yourself becoming enraged!
"All right, sir," the Maitre d' says begrudgingly, "I'll show you to your table now."	"All right, sir," the Maitre d' says begrudgingly, "I'll show you to your table now."
(Sure, now that there are no tables left!)	(Sure, now that there are no tables left!)
"Please, walk this way."	"Please, walk this way."
You think to yourself, "If I walked that way, I'd use talcum powder!"	You think to yourself, "If I walked that way, I'd use talcum powder!"
"Oh, boy," says the Maitre d', sharply clapping his hands, "please set up a table for Mr. Laffer!"	"Oh, boy," says the Maitre d', sharply clapping his hands, "please set up a table for Mr. Laffer!"
"Be seated, Mr. Laffer," says the Maitre d' as he escapes to the kitchen. "Feel free to help yourself at our appetizer bar, and, oh yes, I almost forgot:"	"Be seated, Mr. Laffer," says the Maitre d' as he escapes to the kitchen. "Feel free to help yourself at our appetizer bar, and, oh yes, I almost forgot:"
(Choice location, Larry.)	(Choice location, Larry.)
Ummm.	Ummm.
Yummy.	Yummy.
Bad idea, Larry.	Bad idea, Larry.
For a while, you are afraid you are going to die. Then you are afraid you are NOT going to die!	For a while, you are afraid you are going to die. Then you are afraid you are NOT going to die!
Your last thoughts are, "Maybe it was something I ate..."	Your last thoughts are, "Maybe it was something I ate..."
Pretty clever!	Pretty clever!
But, you find only dust.	But, you find only dust.
(The maid probably has other chores to accomplish!)	(The maid probably has other chores to accomplish!)
It's just a lamp.	It's just a lamp.
The room is very comfortable.	The room is very comfortable.
Will you ever be handsome?	Will you ever be handsome?
Eaaaaagggggtttttthhhhhhh!	Eaaaaagggggtttttthhhhhhh!
(You just scared yourself silly!)	(You just scared yourself silly!)
The toilet is on the south wall of the bathroom.	The toilet is on the south wall of the bathroom.
A bowl filled with complimentary soap is near the sink.	A bowl filled with complimentary soap is near the sink.
A bowl that formerly contained soap is near the sink.	A bowl that formerly contained soap is near the sink.
There isn't one.	There isn't one.
Why? You're not sleepy.	Why? You're not sleepy.
"Starving Artists' Corp."	"Starving Artists' Corp."
What a shame your figure hasn't yet filled out.	What a shame your figure hasn't yet filled out.
There are few people who can fill a bikini like you, Larry!	There are few people who can fill a bikini like you, Larry!
Who says blondes have more fun, Larry?	Who says blondes have more fun, Larry?
"Hey, look!" you cry, "It's me, Larry. Larry Laffer!"	"Hey, look!" you cry, "It's me, Larry. Larry Laffer!"
There is a book of complimentary matches lying on the nightstand near the bed.	There is a book of complimentary matches lying on the nightstand near the bed.
There's nothing left on the nightstand but a lamp, which you don't need.	There's nothing left on the nightstand but a lamp, which you don't need.
There is a beach outside filled with people having fun.	There is a beach outside filled with people having fun.
(Unlike you, Larry!)	(Unlike you, Larry!)
The people are having a "beach" of a good time!	The people are having a "beach" of a good time!
This room is considerably larger than your stateroom on board the cruise ship! It has a picture window overlooking the beach.	This room is considerably larger than your stateroom on board the cruise ship! It has a picture window overlooking the beach.
There is a restroom, plus a dressing area near the picture window.	There is a restroom, plus a dressing area near the picture window.
Leave the toilet where it is!	Leave the toilet where it is!
Ahhhh.	Ahhhh.
No, better leave it there.	No, better leave it there.
You would look sweet, but decide to wait until later.	You would look sweet, but decide to wait until later.
You'd like to wash your hands of this whole affair!;	You'd like to wash your hands of this whole affair!;
It's too bad they don't close, but the darkened glass prevents anyone outside from looking in and seeing you in the dressing area.	It's too bad they don't close, but the darkened glass prevents anyone outside from looking in and seeing you in the dressing area.
"No, everything is NOT ok," you tell the maid.	"No, everything is NOT ok," you tell the maid.
"Well, sir; perhaps you'd like something that is not on the room service menu?" she asks with a smile.	"Well, sir; perhaps you'd like something that is not on the room service menu?" she asks with a smile.
"Hello, my little native beauty," you tell her. %s	"Hello, my little native beauty," you tell her. %s
"Hello, sir," she smiles. "I would like to help you in any way I can."	"Hello, sir," she smiles. "I would like to help you in any way I can."
"Ok. I'm ready," she says with a smile. "How about you?"	"Ok. I'm ready," she says with a smile. "How about you?"
First, move to the other side of the bed.	First, move to the other side of the bed.
Not while there's a lady present!	Not while there's a lady present!
(Boy, do you look sweet!)	(Boy, do you look sweet!)
Have you no modesty? At least move to the dressing area behind the restroom.	Have you no modesty? At least move to the dressing area behind the restroom.
Nah. Why would you want to wear half a bikini?	Nah. Why would you want to wear half a bikini?
You'd better stay in the bikini. It's your only hope of escape.	You'd better stay in the bikini. It's your only hope of escape.
There's no time.	There's no time.
You slip a book of matches into your pocket.	You slip a book of matches into your pocket.
(Gee, Larry; at last you've found your match!)	(Gee, Larry; at last you've found your match!)
(Drum fill)	(Drum fill)
You grab the bowl full of tiny bars of soap and dump it into your pockets thinking, "When I get home, I can carefully wet these, and glue them all together to make at least one regular-sized bar. What a great deal!"	You grab the bowl full of tiny bars of soap and dump it into your pockets thinking, "When I get home, I can carefully wet these, and glue them all together to make at least one regular-sized bar. What a great deal!"
(You have always been terminally cheap!)	(You have always been terminally cheap!)
Your bra is full already!	Your bra is full already!
You aren't wearing a bikini.	You aren't wearing a bikini.
(Are you sure you want to do this?)	(Are you sure you want to do this?)
Have you no modesty? At least move to the room's dressing area behind the restroom.	Have you no modesty? At least move to the room's dressing area behind the restroom.
You have no soap.	You have no soap.
"Good morning, sir! I'm your customer service representative in charge of horizontal surface consistency and custodial maintenance. I trust you are finding everything satisfactory?" she asks.	"Good morning, sir! I'm your customer service representative in charge of horizontal surface consistency and custodial maintenance. I trust you are finding everything satisfactory?" she asks.
(She says she's the maid!)	(She says she's the maid!)
"Ok," says the native maid coyly, "%s"	"Ok," says the native maid coyly, "%s"
"Oh, sir," she smiles demurely, "I just love Americano men; they are so (how you say) 'financial.'"	"Oh, sir," she smiles demurely, "I just love Americano men; they are so (how you say) 'financial.'"
"Well, come on, big boy! What are you waiting for? Don't you want to '%s'"	"Well, come on, big boy! What are you waiting for? Don't you want to '%s'"
"Gee," you tell her, "is this room service, or what?"	"Gee," you tell her, "is this room service, or what?"
"Seester Maria! How many times I gotta tell you? Lay off the white meat!"	"Seester Maria! How many times I gotta tell you? Lay off the white meat!"
"Sister! How many times shall I shoot him?"	"Sister! How many times shall I shoot him?"
Bad choice, Larry! Remember: there's no such thing as a free lunch!	Bad choice, Larry! Remember: there's no such thing as a free lunch!
Bad choice, Larry!	Bad choice, Larry!
While you are indisposed, through the doorway marches the maid's older brother, Carlos.	While you are indisposed, through the doorway marches the maid's older brother, Carlos.
Thanks to U.S. foreign aid, Carlos has many extra bullets that he enjoys firing for amusement!	Thanks to U.S. foreign aid, Carlos has many extra bullets that he enjoys firing for amusement!
You find native women sexy.	You find native women sexy.
(But then, you find any woman sexy!)	(But then, you find any woman sexy!)
"I'm sorry, Meester," says the barber, "I've donna all I canna do to, er, for you. Enjoy your new look!"	"I'm sorry, Meester," says the barber, "I've donna all I canna do to, er, for you. Enjoy your new look!"
"I'm sorry, Meester," says the barber, "I've gotta no more 'pointments today!"	"I'm sorry, Meester," says the barber, "I've gotta no more 'pointments today!"
Funny. This guy doesn't look Italian!	Funny. This guy doesn't look Italian!
"You looka mucho better to me, buddy!"	"You looka mucho better to me, buddy!"
"I gotta no time for a ticky-talky," responds the barber.	"I gotta no time for a ticky-talky," responds the barber.
"Goodda daya, Meester," says the barber. "Canna I helpa you?"	"Goodda daya, Meester," says the barber. "Canna I helpa you?"
"Is there anything you can do for my receding hairline?" you ask the barber.	"Is there anything you can do for my receding hairline?" you ask the barber.
"Butta course, Mister," says the barber, "I gotta jus' ah whacha need."	"Butta course, Mister," says the barber, "I gotta jus' ah whacha need."
"Jus' havva seat inna da chair, please."	"Jus' havva seat inna da chair, please."
"Fora youa today, I gotta special deal," he begins. "Imma gonna try somma my oxydol."	"Fora youa today, I gotta special deal," he begins. "Imma gonna try somma my oxydol."
"Don't you mean 'Minoxidol?'" you ask.	"Don't you mean 'Minoxidol?'" you ask.
"No," he says, "I dunno whata dat is; Imma gonna rubba you head with somma dis liquid laundry detergent!"	"No," he says, "I dunno whata dat is; Imma gonna rubba you head with somma dis liquid laundry detergent!"
(Too late to leave now, Larry. He's got you!)	(Too late to leave now, Larry. He's got you!)
"Dere, alla set," says the barber, "now let'sa justa give it a second ta work."	"Dere, alla set," says the barber, "now let'sa justa give it a second ta work."
"How ridiculous," you think, "I just let some guy I don't even know pour laundry detergent on my head!"	"How ridiculous," you think, "I just let some guy I don't even know pour laundry detergent on my head!"
"WOW!" you exclaim, "Not only does that stuff really work... it's fast, too!"	"WOW!" you exclaim, "Not only does that stuff really work... it's fast, too!"
"I knew you'da be delighted," responds the barber, "comma back anda see me any time, Blondie!"	"I knew you'da be delighted," responds the barber, "comma back anda see me any time, Blondie!"
"Why do you call me that?" you ask.	"Why do you call me that?" you ask.
"Oh, no reason," he says.	"Oh, no reason," he says.
"Oh, great!" you cry, "now what am I supposed to do?"	"Oh, great!" you cry, "now what am I supposed to do?"
"Hava more fun," he answers.	"Hava more fun," he answers.
"Well, at least my bald spot is gone," you say.	"Well, at least my bald spot is gone," you say.
"Along with your self-respect," says the barber. "%s"	"Along with your self-respect," says the barber. "%s"
"Is there anything you can do about my excess body hair?" you ask the barber.	"Is there anything you can do about my excess body hair?" you ask the barber.
"Butta course, Meester," says the barber, "I gotta jus' whacha need."	"Butta course, Meester," says the barber, "I gotta jus' whacha need."
"Justa hava seat inna da chair, please."	"Justa hava seat inna da chair, please."
"Fora youa, today onaly, I gotta special deal," he begins.	"Fora youa, today onaly, I gotta special deal," he begins.
"Somehow I wonder," you reply.	"Somehow I wonder," you reply.
"No," he says, "this'll worka reala good."	"No," he says, "this'll worka reala good."
"What are you going to do to me this time?"	"What are you going to do to me this time?"
"BODY WAXING!"	"BODY WAXING!"
(Once again, he's got you trapped in the chair. You hope this time will turn out better!)	(Once again, he's got you trapped in the chair. You hope this time will turn out better!)
"Dere, alla set," says the barber, "now justa lay dere and let it geta hard."	"Dere, alla set," says the barber, "now justa lay dere and let it geta hard."
"How could I be so stupid," you think, "I have wax hardening all over my naked body!"	"How could I be so stupid," you think, "I have wax hardening all over my naked body!"
"Yeeeeee yoooowwwwww!"	"Yeeeeee yoooowwwwww!"
"Oh, gawd!" you cry, "was it good for you?"	"Oh, gawd!" you cry, "was it good for you?"
"I donna think that could be good for anybody!" he answers.	"I donna think that could be good for anybody!" he answers.
"Well, perhaps the pain was worth it; I DO like this 'clean-shaven' look!" you tell him.	"Well, perhaps the pain was worth it; I DO like this 'clean-shaven' look!" you tell him.
"You're the only one," concludes the barber. "%s"	"You're the only one," concludes the barber. "%s"
"Whoa-aaah! Hellooo, baaabee," cries the KGB agent, "Oooh, honey, I thinks I loves ya!!"	"Whoa-aaah! Hellooo, baaabee," cries the KGB agent, "Oooh, honey, I thinks I loves ya!!"
(Vhat happened to his accent?)	(Vhat happened to his accent?)
You did it! You made it across the beach without being caught by the KGB agents!!	You did it! You made it across the beach without being caught by the KGB agents!!
What lies ahead now?!	What lies ahead now?!
Don't! They might recognize your voice.	Don't! They might recognize your voice.
Two particularly interesting guys are wearing slouch hats and trench coats.	Two particularly interesting guys are wearing slouch hats and trench coats.
Funny. This entire beach is filled with men.	Funny. This entire beach is filled with men.
"I have him!" cries the agent.	"I have him!" cries the agent.
"Ve caught ju, ju vicious villian of the People!" shouts the KGB agent, by now growing quite hoarse.	"Ve caught ju, ju vicious villian of the People!" shouts the KGB agent, by now growing quite hoarse.
"How did you know it was me?" you ask.	"How did you know it was me?" you ask.
"Only in Russia do vomen have such body hair!" he answers.	"Only in Russia do vomen have such body hair!" he answers.
"Ve caught ju, ju pawn of the proletariat!" screams the poorly disguised KGB agent.	"Ve caught ju, ju pawn of the proletariat!" screams the poorly disguised KGB agent.
"Only in Russia do vomen have such flat chests!" he responds.	"Only in Russia do vomen have such flat chests!" he responds.
"Ve caught ju, ju capitalist slime-sucking pig," shouts the KGB agent, "we vill make you ze best-looking fashion model in all U.S.S.R!"	"Ve caught ju, ju capitalist slime-sucking pig," shouts the KGB agent, "we vill make you ze best-looking fashion model in all U.S.S.R!"
"Only in Russia do women wear leisure suits to beach!" he replies.	"Only in Russia do women wear leisure suits to beach!" he replies.
