"Hey, you!" cries the woman, "Where have you been? We've been looking all over for you."	"Hey, you!" cries the woman, "Where have you been? We've been looking all over for you."
"I just won 'The Dating Connection,'" you reply.	"I just won 'The Dating Connection,'" you reply.
"Big deal. You were supposed to wait here. Now hurry and follow me!"	"Big deal. You were supposed to wait here. Now hurry and follow me!"
(Oh no, Larry. Here we go again!)	(Oh no, Larry. Here we go again!)
The control room talkback speaker crackles, "Five seconds to air, boys and girls. Five seconds to air! Places, everybody!"	The control room talkback speaker crackles, "Five seconds to air, boys and girls. Five seconds to air! Places, everybody!"
This doesn't look at all like you expected a lottery show to look. But, just in case, you decide to grab a seat on that empty stool over there.	This doesn't look at all like you expected a lottery show to look. But, just in case, you decide to grab a seat on that empty stool over there.
The voiceover announcer says, "From Hollywood, it's the latest and greatest in embarrassment programming -- the all new 'Dating Connection!'"	The voiceover announcer says, "From Hollywood, it's the latest and greatest in embarrassment programming -- the all new 'Dating Connection!'"
"And here's your host, Biff Barf!"	"And here's your host, Biff Barf!"
"Thank you and welcome; welcome, everybody! I'm so glad you're here for the all new 'Dating Connection.'"	"Thank you and welcome; welcome, everybody! I'm so glad you're here for the all new 'Dating Connection.'"
"We're just about ready to play our game, so let's meet our contestants. Who's going to make their big 'Dating Connection' today?"	"We're just about ready to play our game, so let's meet our contestants. Who's going to make their big 'Dating Connection' today?"
"Biff, today's lovely bachelorette is Barbara Bimbo, of Airhead, California."	"Biff, today's lovely bachelorette is Barbara Bimbo, of Airhead, California."
"Barbara's hobbies are computer programming, creating unusual milkshakes, and tantalizing elderly men. She lists her turn-ons as industrial-grade blenders and RS-232 interfacing."	"Barbara's hobbies are computer programming, creating unusual milkshakes, and tantalizing elderly men. She lists her turn-ons as industrial-grade blenders and RS-232 interfacing."
"Turn-offs include international military conflicts and the aroma of rosin-core solder."	"Turn-offs include international military conflicts and the aroma of rosin-core solder."
"On the left is bachelor number one, a professional surfboard waxer from Gumbo, Missouri. His hobbies include collecting braunschweiger casings, speculating on the sexual preference of professional dancers, and watching televised opera with the sound off."	"On the left is bachelor number one, a professional surfboard waxer from Gumbo, Missouri. His hobbies include collecting braunschweiger casings, speculating on the sexual preference of professional dancers, and watching televised opera with the sound off."
"Meet Davie Blair!"	"Meet Davie Blair!"
"Bachelor number two is today's token intellectual. He is presently chairman of the Physics Department at our local university, F.U."	"Bachelor number two is today's token intellectual. He is presently chairman of the Physics Department at our local university, F.U."
"Originally from Pakistan, Ohio, meet Raguka Singh Soong."	"Originally from Pakistan, Ohio, meet Raguka Singh Soong."
Hey, that's not your name!	Hey, that's not your name!
"Uh, excuse me," you shout. %s	"Uh, excuse me," you shout. %s
"Ok, Raguka Larry," responds Biff. "Whatever you want to call yourself is ok with me!"	"Ok, Raguka Larry," responds Biff. "Whatever you want to call yourself is ok with me!"
"And, on the far right today is bachelor number three, a journalism major who quit college in order to pursue his dream job: fact-checker on the 'National Enquiry' newspaper."	"And, on the far right today is bachelor number three, a journalism major who quit college in order to pursue his dream job: fact-checker on the 'National Enquiry' newspaper."
"Currently unemployed, meet A. P. Wire!"	"Currently unemployed, meet A. P. Wire!"
"And now, it's time to play 'The Dating Connection!'" says Biff Barf. "Barbara, may we have your first question please?"	"And now, it's time to play 'The Dating Connection!'" says Biff Barf. "Barbara, may we have your first question please?"
"Ok like thanks, Biff, ya know," says Barbara. "Bachelor number one, like this one's for you!"	"Ok like thanks, Biff, ya know," says Barbara. "Bachelor number one, like this one's for you!"
"If I was to go like out on a you know date with you and you was like you know all dressed up or sumpthin' and like the car busted and we had to walk for help and I like broke a you know heel like how would you fix it?"	"If I was to go like out on a you know date with you and you was like you know all dressed up or sumpthin' and like the car busted and we had to walk for help and I like broke a you know heel like how would you fix it?"
("Like you know" it seems obvious her elevator doesn't reach her penthouse!)	("Like you know" it seems obvious her elevator doesn't reach her penthouse!)
"Why, beautiful, if you were with me you wouldn't have to worry about any ol' breakdown. We'd be cruisin' in my brand new Porsche, and you wouldn't have a care in the world."	"Why, beautiful, if you were with me you wouldn't have to worry about any ol' breakdown. We'd be cruisin' in my brand new Porsche, and you wouldn't have a care in the world."
"Besides, if something did happen to your heel, I'd just sweep you up in these muscular arms and carry you wherever you wanted to go! When you're a top notch physical specimen like me, a light little feather like you would be a breeze."	"Besides, if something did happen to your heel, I'd just sweep you up in these muscular arms and carry you wherever you wanted to go! When you're a top notch physical specimen like me, a light little feather like you would be a breeze."
(You're sure not even this mental midget would fall for a cornball line like that!)	(You're sure not even this mental midget would fall for a cornball line like that!)
"Geeeeez, how romantic!" she gushes. "What more could any girl want?"	"Geeeeez, how romantic!" she gushes. "What more could any girl want?"
"Well, bachelor, you're 'number one' with me!"	"Well, bachelor, you're 'number one' with me!"
(So much for your theory, Larry!)	(So much for your theory, Larry!)
"And now, how about you, bachelor number two?" she asks you. "How would you solve this puzzle?"	"And now, how about you, bachelor number two?" she asks you. "How would you solve this puzzle?"
Ok, Larry, that's your cue. You're ON!	Ok, Larry, that's your cue. You're ON!
"Well, Raguka Larry," prompts Biff Barf, "we're waiting for your answer!"	"Well, Raguka Larry," prompts Biff Barf, "we're waiting for your answer!"
"Uhhh, well, er," you stumble, "%s"	"Uhhh, well, er," you stumble, "%s"
"Who let in that jerk?!" Barbara squeals. "What a putz!"	"Who let in that jerk?!" Barbara squeals. "What a putz!"
Barbara attempts to assume an intelligent expression. "Now how about you bachelor number you know three?"	Barbara attempts to assume an intelligent expression. "Now how about you bachelor number you know three?"
"Bachelorette Barbie, my deepest, personal feelings are that you are far too sexy for me ever to allow you to leave my highly-expensive, beachfront, swinging bachelor apartment."	"Bachelorette Barbie, my deepest, personal feelings are that you are far too sexy for me ever to allow you to leave my highly-expensive, beachfront, swinging bachelor apartment."
"You and I would spend all our time together alone, sharing each other in every way (if you know what I mean)!"	"You and I would spend all our time together alone, sharing each other in every way (if you know what I mean)!"
(How's that for a way with words?)	(How's that for a way with words?)
"Oooooh, how sexy!" she gushes. "What more could any girl want?"	"Oooooh, how sexy!" she gushes. "What more could any girl want?"
"You may be bachelor number three on this program, but you're 'number one' in my heart!"	"You may be bachelor number three on this program, but you're 'number one' in my heart!"
(Do you think anyone's still watching this tripe?)	(Do you think anyone's still watching this tripe?)
"Barbara, in my opinion you've just asked one of our best questions ever," says Biff Barf. "Now, do you think you could come up with another great question?"	"Barbara, in my opinion you've just asked one of our best questions ever," says Biff Barf. "Now, do you think you could come up with another great question?"
Once again, Barbara burns off a few million brain cells attempting to rise to the occasion.	Once again, Barbara burns off a few million brain cells attempting to rise to the occasion.
"Ok like thanks Biff ya know," says Barbara. "Bachelor number one, like this one's for you!"	"Ok like thanks Biff ya know," says Barbara. "Bachelor number one, like this one's for you!"
"Like if you was a you know insect and like I was a you know flower what kind of you know insect would you like be and like what kind of flower am I?"	"Like if you was a you know insect and like I was a you know flower what kind of you know insect would you like be and like what kind of flower am I?"
"Barbara," responds bachelor number one, "I'd be a beautiful butterfly and you'd be my tender little buttercup. Together, we'd build a wonderful garden of love!"	"Barbara," responds bachelor number one, "I'd be a beautiful butterfly and you'd be my tender little buttercup. Together, we'd build a wonderful garden of love!"
(At least his garden would be well-fertilized!)	(At least his garden would be well-fertilized!)
"Like you ARE quite the charmer, aren't you, number one?" she gushes. "I'd love to sow a few seeds with you!"	"Like you ARE quite the charmer, aren't you, number one?" she gushes. "I'd love to sow a few seeds with you!"
"Biff," she says, "MUST I like waste our time asking El Dorko this question?"	"Biff," she says, "MUST I like waste our time asking El Dorko this question?"
Biff responds, "Why, of course, Bachelorette Barbara. You must follow the rules!"	Biff responds, "Why, of course, Bachelorette Barbara. You must follow the rules!"
"Ok, bore number two," she says sarcastically, "can you know even like remember the question?"	"Ok, bore number two," she says sarcastically, "can you know even like remember the question?"
Come on, Larry. Fire your best shot!	Come on, Larry. Fire your best shot!
"Come on, El Do--, uh I mean Raguka Larry," stammers Biff Barf, "we need your answer now!"	"Come on, El Do--, uh I mean Raguka Larry," stammers Biff Barf, "we need your answer now!"
"Er, um, I think, ah that is," you stumble, "%s"	"Er, um, I think, ah that is," you stumble, "%s"
"Like, what planet beamed this spook down?!" she squeaks. "I've heard better lines in a you know nursing home!"	"Like, what planet beamed this spook down?!" she squeaks. "I've heard better lines in a you know nursing home!"
"Well, bachelor number three," she says, "I can't you know wait to learn like what insect are you and like what flower am you know I?"	"Well, bachelor number three," she says, "I can't you know wait to learn like what insect are you and like what flower am you know I?"
"Barbie doll, you'd be my precious American Beauty rose and I'd be your little bumblebee. I know you'd enjoy rubbing a little of your pollen on MY stinger!"	"Barbie doll, you'd be my precious American Beauty rose and I'd be your little bumblebee. I know you'd enjoy rubbing a little of your pollen on MY stinger!"
(Does this show supply antacids?)	(Does this show supply antacids?)
"Well, number three, we certainly are the oversexed little devil, aren't we?!" Barbara gushes.	"Well, number three, we certainly are the oversexed little devil, aren't we?!" Barbara gushes.
"Hold it right there!" interjects Biff, "I'm afraid that's all the time we have for questions today. Bachelorette Barbie: it's time for you to make your 'Dating Connection!'"	"Hold it right there!" interjects Biff, "I'm afraid that's all the time we have for questions today. Bachelorette Barbie: it's time for you to make your 'Dating Connection!'"
Barbie smiles, "Well, Biff, it's really difficult to choose; both men are really terrific!"	Barbie smiles, "Well, Biff, it's really difficult to choose; both men are really terrific!"
(Something makes you feel the "both" doesn't include you!)	(Something makes you feel the "both" doesn't include you!)
"Yes, but I'm sure the audience has already made its decision," says Biff.	"Yes, but I'm sure the audience has already made its decision," says Biff.
"Yes," says Barbara, "and I've made my decision, you know, too."	"Yes," says Barbara, "and I've made my decision, you know, too."
Biff looks surprised, "Ok, bachelor TWO it is. But frankly, Bachelorette Barbara, I must admit I'm a little surprised!"	Biff looks surprised, "Ok, bachelor TWO it is. But frankly, Bachelorette Barbara, I must admit I'm a little surprised!"
(Did he say bachelor number TWO?)	(Did he say bachelor number TWO?)
"Barbara, I think most of us expected a different choice!" says Biff Barf.	"Barbara, I think most of us expected a different choice!" says Biff Barf.
"WAIT, BIFF!" shouts Barbara, "I wanted bachelor number THREE!!!"	"WAIT, BIFF!" shouts Barbara, "I wanted bachelor number THREE!!!"
"I'm sorry, Barbara," says Biff, "the rules clearly state your first decision is final."	"I'm sorry, Barbara," says Biff, "the rules clearly state your first decision is final."
"Let's find out what they've won!"	"Let's find out what they've won!"
The voiceover announcer booms, "It's a CRUISE!"	The voiceover announcer booms, "It's a CRUISE!"
(audience goes oooooh)	(audience goes oooooh)
"Yes, a romantic cruise of the South Pacific on the beautiful U.S.S. Love Tub."	"Yes, a romantic cruise of the South Pacific on the beautiful U.S.S. Love Tub."
"You'll spend a solid MONTH together, exploring exotic ports of call courtesy of Wonder Cruise Lines."	"You'll spend a solid MONTH together, exploring exotic ports of call courtesy of Wonder Cruise Lines."
"Remember: if it's a good cruise, it's a Wonder!"	"Remember: if it's a good cruise, it's a Wonder!"
"And for our other contestants, why, you lucky fellows have won a year's supply of armadillo polish, twenty cases of black shoe laces, plus a copy of our home game."	"And for our other contestants, why, you lucky fellows have won a year's supply of armadillo polish, twenty cases of black shoe laces, plus a copy of our home game."
"Hey, man! There ain't no way I'm spendin' no month on a boat with this jerk," shouts the delicate Bachelorette Barbara. "I wanna chance to hit on that number three guy!!"	"Hey, man! There ain't no way I'm spendin' no month on a boat with this jerk," shouts the delicate Bachelorette Barbara. "I wanna chance to hit on that number three guy!!"
"I'm sure she's really truly delighted, folks," says Biff attempting to cover, "Now come on -- let's really hear it for our lucky couple."	"I'm sure she's really truly delighted, folks," says Biff attempting to cover, "Now come on -- let's really hear it for our lucky couple."
(a smattering of applause)	(a smattering of applause)
The voiceover announcer says, "Be sure to tune in tomorrow night, same time, same station, for the finest in embarrassment programming: the all new 'Dating Connection.' Good night."	The voiceover announcer says, "Be sure to tune in tomorrow night, same time, same station, for the finest in embarrassment programming: the all new 'Dating Connection.' Good night."
The control room speaker crackles, "Ok, gang, that's another one in the can! Raguka Larry, please report to the green room to receive your prizes. The rest of you just stay where you are!"	The control room speaker crackles, "Ok, gang, that's another one in the can! Raguka Larry, please report to the green room to receive your prizes. The rest of you just stay where you are!"
Gosh, Larry, what good luck you have: winning a fun-filled, month-long cruise with that lovely bachelorette Barbara!	Gosh, Larry, what good luck you have: winning a fun-filled, month-long cruise with that lovely bachelorette Barbara!
"Ladies and gentlemen, we've finally found him!" says the master of ceremonies. "Yes, we've found our last Lucky Life Lottery contestant of this week's show!"	"Ladies and gentlemen, we've finally found him!" says the master of ceremonies. "Yes, we've found our last Lucky Life Lottery contestant of this week's show!"
"And here he is now... Mr. Larry uh," he double-checks the teleprompter, "Laffer? Yeah, Mr. Larry Laffer!"	"And here he is now... Mr. Larry uh," he double-checks the teleprompter, "Laffer? Yeah, Mr. Larry Laffer!"
(a little applause)	(a little applause)
"Mr. Laffer, we don't have time for our normal introductory chit-chat. Just step right up to the wheel and give 'er a big spin!"	"Mr. Laffer, we don't have time for our normal introductory chit-chat. Just step right up to the wheel and give 'er a big spin!"
Under his breath, the MC admonishes you: "(Hurry up, Laffer! We're already runnin' late because we couldn't find you!)"	Under his breath, the MC admonishes you: "(Hurry up, Laffer! We're already runnin' late because we couldn't find you!)"
Nervously, you reach for the wheel, knowing full well that the pleasure of America's 3-D, graphic, animated, adventure game players is riding on the luck of your pull!	Nervously, you reach for the wheel, knowing full well that the pleasure of America's 3-D, graphic, animated, adventure game players is riding on the luck of your pull!
"He did it! HE DID IT! He's won the big one!!  Ladies and gentlemen, Larry Laffer just won the largest prize in the history of the Lottery -- a million dollars a year for life!!"	"He did it! HE DID IT! He's won the big one!!  Ladies and gentlemen, Larry Laffer just won the largest prize in the history of the Lottery -- a million dollars a year for life!!"
(applause)	(applause)
(tons o' applause)	(tons o' applause)
"Come on over here, Lucky Larry."	"Come on over here, Lucky Larry."
"Here comes lovely Lanna Light, the Lucky Life Lottery lady, with Larry Laffer's first year's winnings: the U. S. Treasury Department's first one million dollar bill!"	"Here comes lovely Lanna Light, the Lucky Life Lottery lady, with Larry Laffer's first year's winnings: the U. S. Treasury Department's first one million dollar bill!"
"On behalf of the Lucky Life Lottery, I'm pleased to present you our Grand Prize, one million dollars!" says the MC.	"On behalf of the Lucky Life Lottery, I'm pleased to present you our Grand Prize, one million dollars!" says the MC.
"Congratulations, Mr. Laffer," says the MC, "you're a lucky man! Too bad we don't have time for a speech!"	"Congratulations, Mr. Laffer," says the MC, "you're a lucky man! Too bad we don't have time for a speech!"
"Let's hear it for him, ladies and gentlemen: Mr. Larry Laffer, the luckiest guy in Los Angeles!!"	"Let's hear it for him, ladies and gentlemen: Mr. Larry Laffer, the luckiest guy in Los Angeles!!"
(even more applause)	(even more applause)
The voiceover announcer says, "That's it for this week's show; be sure to tune in next time for the 'Lucky Life Lottery' show, live from Hollywood!"	The voiceover announcer says, "That's it for this week's show; be sure to tune in next time for the 'Lucky Life Lottery' show, live from Hollywood!"
"Good night."	"Good night."
The control room talkback speaker crackles, "Ok, kids, there's another one that's good enough for who it's for!"	The control room talkback speaker crackles, "Ok, kids, there's another one that's good enough for who it's for!"
"Mr. Laffer, please exit through the door to the left; there will be plenty of reporters and photographers waiting for you!"	"Mr. Laffer, please exit through the door to the left; there will be plenty of reporters and photographers waiting for you!"
Gee, Larry, things are finally beginning to go your way! First, you win a month-long ocean voyage with the lovely bachelorette, and now you win the biggest lottery prize in history.	Gee, Larry, things are finally beginning to go your way! First, you win a month-long ocean voyage with the lovely bachelorette, and now you win the biggest lottery prize in history.
(Something tells you this is too good to last!)	(Something tells you this is too good to last!)
There's not one single cup left in the whole joint!	There's not one single cup left in the whole joint!
There's only one soda cup left in the place, the speciality of the house: a "Grotesque Gulp."	There's only one soda cup left in the place, the speciality of the house: a "Grotesque Gulp."
GG's are legendary in the Los Angeles area -- it's the only soft drink served in a painted 32-gallon trash can!	GG's are legendary in the Los Angeles area -- it's the only soft drink served in a painted 32-gallon trash can!
There are no more tickets available here.	There are no more tickets available here.
"You too can be rich and famous!  Play the Lucky Life Lottery game!  Luck-O Buck-O Tickets available here!"	"You too can be rich and famous!  Play the Lucky Life Lottery game!  Luck-O Buck-O Tickets available here!"
There are two machines here: a Luck-O Buck-O lottery ticket machine and a soda dispenser.	There are two machines here: a Luck-O Buck-O lottery ticket machine and a soda dispenser.
This Quikie Mart has many items for sale. A clerk lounges sleepily behind the counter near a lottery ticket machine. There is a soda dispenser near the front window.	This Quikie Mart has many items for sale. A clerk lounges sleepily behind the counter near a lottery ticket machine. There is a soda dispenser near the front window.
You try as hard as you can, but you just can't force that soda back into the nozzles!	You try as hard as you can, but you just can't force that soda back into the nozzles!
"Hey, you can't do that!" orders the clerk. "Once you pour 'em, you gotta keep 'em!"	"Hey, you can't do that!" orders the clerk. "Once you pour 'em, you gotta keep 'em!"
"Sorry, pardner," says the clerk, "we're all out of Luck-O Buck-Os for this week!"	"Sorry, pardner," says the clerk, "we're all out of Luck-O Buck-Os for this week!"
Move closer to the clerk to buy a ticket.	Move closer to the clerk to buy a ticket.
"May I have a free lottery ticket, please? I have no money!"	"May I have a free lottery ticket, please? I have no money!"
The clerk responds, "We ain't runnin' no charity here, cowboy. You wanna lottery ticket? You gotta pay for it."	The clerk responds, "We ain't runnin' no charity here, cowboy. You wanna lottery ticket? You gotta pay for it."
"That'll be a buck, please," she says.	"That'll be a buck, please," she says.
You show your lottery ticket to the clerk.	You show your lottery ticket to the clerk.
"I donno if it's any good or not. We don't cash 'em; we just sell 'em!"	"I donno if it's any good or not. We don't cash 'em; we just sell 'em!"
Perhaps you should use the soda dispenser.	Perhaps you should use the soda dispenser.
Why pay? You don't owe any money.	Why pay? You don't owe any money.
The clerk just laughs, "Do I look like I could break a million-dollar bill?"	The clerk just laughs, "Do I look like I could break a million-dollar bill?"
"I can't give you credit on that ticket, pardner." says the clerk. "You're gonna havta come up with some real money to pay for a soda like that!"	"I can't give you credit on that ticket, pardner." says the clerk. "You're gonna havta come up with some real money to pay for a soda like that!"
"Here's a dollar for my 'Grotesque Gulp'" you offer.	"Here's a dollar for my 'Grotesque Gulp'" you offer.
The clerk responds, "We ain't runnin' no charity here, cowboy. You wanna soda? You gotta pay for it."	The clerk responds, "We ain't runnin' no charity here, cowboy. You wanna soda? You gotta pay for it."
"That'll be thirty-two bucks, please," she says.	"That'll be thirty-two bucks, please," she says.
That's a good value, Larry -- only a dollar a gallon! Too bad you only have one dollar on you.	That's a good value, Larry -- only a dollar a gallon! Too bad you only have one dollar on you.
You have no money to give her.	You have no money to give her.
"Here's a hundred-dollar bill," you offer.	"Here's a hundred-dollar bill," you offer.
"Ok, pardner," says the clerk. "Too bad we don't keep any change at this time of night!"	"Ok, pardner," says the clerk. "Too bad we don't keep any change at this time of night!"
"But it's broad daylight," you protest!	"But it's broad daylight," you protest!
"%s" she concludes.	"%s" she concludes.
You must obtain those in the "Land of the Lounge Lizards!"	You must obtain those in the "Land of the Lounge Lizards!"
You don't need to do that.	You don't need to do that.
A cup that large might take a long time to fill.	A cup that large might take a long time to fill.
A cup that large might take FOREVER to fill!	A cup that large might take FOREVER to fill!
Finally, you top it off, while you carefully consider how you're going to pick it up.	Finally, you top it off, while you carefully consider how you're going to pick it up.
Ah, what the hell. This isn't real life... but merely an incredible simulation!  You decide to put it in your pocket, along with everything else.	Ah, what the hell. This isn't real life... but merely an incredible simulation!  You decide to put it in your pocket, along with everything else.
Ah, shucks! This isn't real life... but merely an incredible simulation!  You decide to put it in your pocket, along with everything else.	Ah, shucks! This isn't real life... but merely an incredible simulation!  You decide to put it in your pocket, along with everything else.
Suddenly the woman behind the counter comes to life!	Suddenly the woman behind the counter comes to life!
