"I can't give you credit on that ticket, pardner." says the clerk. "You're gonna havta come up with some real money to pay for a soda like that!"	「我沒法讓你賒帳啦，老兄。」店員說道。「想喝這種汽水，你得拿出真鈔票才行！」
"Here's a dollar for my 'Grotesque Gulp'" you offer.	「這是一塊錢，買我的『噁心大杯』。」你說。
The clerk responds, "We ain't runnin' no charity here, cowboy. You wanna soda? You gotta pay for it."	店員回答：「我們這不是做慈善的，牛仔。想喝汽水？掏錢。」
"That'll be thirty-two bucks, please," she says.	「一共三十二塊，麻煩了。」她說。
That's a good value, Larry -- only a dollar a gallon! Too bad you only have one dollar on you.	賴瑞，這價錢挺划算的——一加侖才一塊錢！可惜你身上只有一塊錢。
You have no money to give her.	你身上沒錢可以給她。
"Here's a hundred-dollar bill," you offer.	「這是一張一百元大鈔。」你說。
"Ok, pardner," says the clerk. "Too bad we don't keep any change at this time of night!"	「好啊，老兄，」店員說。「可惜這個時間我們沒零錢找！」
"But it's broad daylight," you protest!	「可是現在明明是大白天！」你抗議道！
"%s" she concludes.	「%s」她做出結論。
You must obtain those in the "Land of the Lounge Lizards!"	你得去《酒吧浪子》裡才能拿到那些東西！
You don't need to do that.	你不需要那麼做。
A cup that large might take a long time to fill.	那麼大的杯子可能要裝很久才會滿。
A cup that large might take FOREVER to fill!	那麼大的杯子可能要裝到天荒地老才會滿！
Finally, you top it off, while you carefully consider how you're going to pick it up.	終於裝滿了，你一邊盤算著該怎麼把它端起來。
Ah, what the hell. This isn't real life... but merely an incredible simulation!  You decide to put it in your pocket, along with everything else.	管他的，這又不是真實人生……只是一場超扯的模擬遊戲！你決定把它塞進口袋，跟其他東西擺一起。
Ah, shucks! This isn't real life... but merely an incredible simulation!  You decide to put it in your pocket, along with everything else.	唉呀，這又不是真實人生……只是一場超扯的模擬遊戲！你決定把它塞進口袋，跟其他東西擺一起。
Suddenly the woman behind the counter comes to life!	突然，櫃檯後的女人活了過來！
"Hold it right there, pardner," she cries, "you ain' a gonna rustle no soda offn me!"	「站住別動，老兄，」她大喊，「別想從我這偷汽水！」
"Yeeeee haaaaaa," screams the clerk, "you're one dead Coke sucker!"	「呀——呵——」店員尖叫，「你這可樂鬼死定了！」
Enunciate carefully, please!	麻煩講清楚一點！
"Here's my last dollar," you say, handing it to the cute clerk. "How about selling me one of those Luck-O Buck-O Lottery tickets?"	「這是我最後一塊錢，」你說著遞給那位可愛的店員。「賣我一張『幸運發財』樂透彩券吧？」
"Ok, pardner," says the clerk, "here ya go. Just stick this here ticket in that machine on the end of the counter."	「好啊，老兄，」店員說，「拿去吧。把這張彩券塞進櫃檯那頭的機器裡就行了。」
"Good luck!" she concludes. "%s"	「祝你好運！」她最後說道。「%s」
You insert the paper ticket into the Luck-O Buck-O machine.	你把彩券塞進「幸運發財」彩券機裡。
The Luck-O Buck-O Lottery machine's video display screen flashes, "Please enter your six numbers between 100 and 999 now."	「幸運發財」樂透機的螢幕閃爍著：「請輸入你的六個號碼，範圍在一百到九百九十九之間。」
"Processing..."	「處理中……」
Out pops your Luck-O Buck-O lottery ticket. You take it and wonder, "Will I be a winner?"	你的「幸運發財」樂透彩券彈了出來。你拿起它，心想：「我會中獎嗎？」
"Hello, baby!" you tell her. %s	「哈囉，寶貝！」你對她說。%s
"Hi, y'all," she replies in a charming drawl. "Ya shore have a white suit."	「嗨，你好啊，」她用迷人的南方腔調回答。「你這身白西裝真好看。」
You have always admired Southern girls.	你一向對南方女孩很有好感。
You vow to try again. "That's really a charming Southern accent," you say. "I'll bet you're from the South."	你發誓要再試一次。「妳這南方口音真迷人，」你說。「我敢打賭妳是南方來的。」
"Why, shucks," she replies, "you're right! Howdja know I was from Orange County?"	「哎呀，」她回答，「被你說中了！你怎麼知道我是橘郡來的？」
"What do you say, baby?" you turn on your charm afterburner, "How's about you and me gettin' it on!"	「妳說呢，寶貝？」你把魅力全開催到底，「妳跟我要不要來點什麼？」
"Gettin' it on what?" she asks.	「來點什麼？」她問。
You find Southern women sexy.	你覺得南方女人很性感。
There are instruments here from many diverse ethnic cultures. The studios at the rear of the store are filled with people plucking their charangos!	店裡擺滿來自各種不同民族文化的樂器。店後方的琴房裡，滿是彈奏「查朗戈」琴的人！
A beautiful Latin lady waits behind the counter, watching your every move.	一位美麗的拉丁美女站在櫃檯後，緊盯著你的一舉一動。
At last, a carpet! You thought this whole city was paved.	終於看到一塊地毯了！你還以為這整座城市都鋪滿了柏油。
The door beneath the bell is clearly labeled "IN" and thus should not be used. However, the door in the south wall is labeled: "OUT."	門鈴下方的門上清楚標著「入口」，所以不該從這裡走。不過南面牆上的門則標著：「出口」。
Along the walls are locked practice rooms.	沿著牆邊是一間間上了鎖的練習室。
It's a pretty carpet, isn't it?	這地毯挺漂亮的，對吧？
"Ye Olde Ethno-Musicology Shoppe" is filled with unusual instruments from the four corners of the world.	「民族音樂學小舖」裡擺滿了來自世界各地的奇特樂器。
(You wonder which ethnic subculture makes such extensive use of electric amplifiers and drum sets!)	（你很好奇到底是哪個民族次文化這麼愛用電子擴大機和爵士鼓組！）
Perhaps you should talk to the clerk first to see if it's all right for you to mess around with the instruments.	也許你該先跟店員說一聲，問問能不能碰碰這些樂器。
"Do you have change for a million?" you ask the clerk.	「你能找開一百萬嗎？」你問店員。
"Non habla anglais," replies the clerk.	「Non habla anglais」店員回答。
"May I buy something here?" you ask.	「我可以在這裡買點東西嗎？」你問。
"Hello, beautiful," you tell her. %s	「哈囉，美女，」你對她說。%s
"Buenos dias, Senor." she responds with a blank stare.	「Buenos dias, Senor。」她面無表情地回答。
(Apparently she doesn't speak English.)	（看來她不會說英語。）
"Hi, beautiful," you attempt to lay a little smooth-mouth on the lovely Latin lady. %s	「嗨，美女，」你試著對這位迷人的拉丁美女耍點嘴皮子。%s
"Buenos dias, Senor Dos assistanta bello bono?" la senorita el talkos.	"Buenos dias, Senor Dos assistanta bello bono?" la senorita el talkos.
("Good day, Sir. How may I help you?")	（「日安，先生。有什麼能為您效勞的嗎？」）
Suddenly, she smiles broadly... as if she recognizes you!	她突然綻放笑容……彷彿認出了你！
Her smile makes you glad you took Spanish in high school.	她的笑容讓你慶幸高中時有修西班牙文。
(Too bad you slept through it!)	（可惜你整堂課都在打瞌睡！）
Aw, what the hell. You decide to brush the dust off your Spanish by attempting a conversation with the lovely senorita.	管他的。你決定拍掉塵封已久的西班牙文，試著跟這位迷人的少女聊上幾句。
Aw, what the heck. You decide to brush the dust off your Spanish by attempting a conversation with the lovely senorita.	管他的。你決定拍掉塵封已久的西班牙文，試著跟這位迷人的少女聊上幾句。
Perhaps you could begin by complimenting her on her extremely good looks...	或許你可以先誇獎一下她的絕世美貌……
"El pesto la guardia say spermo boobitos," you tell her.	"El pesto la guardia say spermo boobitos," you tell her.
("Your ears remind me of whale breasts.")	（「妳的耳朵讓我想起鯨魚的胸部。」）
Her face brightens further -- she seems genuinely interested in you. Your Spanish must not be so bad after all!	她的表情更加開朗了——看來她似乎真的對你有興趣。看樣子你的西班牙文也沒那麼糟嘛！
"Si, sa la luna el gross et poopie-doggie la bambino," la senorita reporitos.	"Si, sa la luna el gross et poopie-doggie la bambino," la senorita reporitos.
("Yes, but the moon is full, and you are a chihuahua.")	（「是的，不過月亮是滿的，而你是隻吉娃娃。」）
Whoa! Speaking is one thing, but understanding is another! Her response baffles you completely. You have no idea what she means.	哇！會講是一回事，聽得懂又是另一回事！她的回答讓你徹底摸不著頭緒，你完全不知道她在說什麼。
Of course, that's never stopped you before...	不過，這種事以前也從沒攔住過你……
"El pencilo es tubular, rigido amarillo," you tell her.	"El pencilo es tubular, rigido amarillo," you tell her.
("My pencil is long, hard and yellow.")	（「我的鉛筆又長又硬又黃。」）
"El hombre del na nostra donde esta majora signale. La writo de stupido sententates," la senorita charma.	"El hombre del na nostra donde esta majora signale. La writo de stupido sententates," la senorita charma.
("So you're finally here! I thought you'd never show up. By the way, who writes these secret phrases, anyway?")	（「你總算來了！我還以為你永遠不會出現呢。話說回來，這些暗號句子到底是誰寫的啊？」）
"La microfiche la enigm big dealo onklunk no touche, Dr. Nonookee el commie."	"La microfiche la enigm big dealo onklunk no touche, Dr. Nonookee el commie."
("The microfiche containing the secrets to the recent United States' superconductor research breakthrough is hidden inside this rare, Peruvian onklunk. Don't let anyone touch it before you personally deliver it to Dr. Nonookee. And (I don't need to tell you) be careful: he, and he alone, has the authority to deliver it to the USSR agents!")	（「藏有美國最新超導體研究突破機密的縮影膠片，就藏在這個罕見的秘魯『昂克隆』樂器裡。在你親自交給諾努基博士之前，別讓任何人碰它。而且（這點我不用多說吧）務必小心：只有他，唯獨他，才有權把它交給蘇聯特務！」）
"Mucho gracias, la Senorita, 	"Mucho gracias, la Senorita,
("Thanks, I guess.")	（「謝了，我想。」）
As best you can tell, she wants you to keep that unusual musical instrument on the counter. So, rather than risk offending her generosity, you take it.	你猜她大概是要你收下櫃檯上那件奇特的樂器。與其冒險得罪她的好意，你還是收下了。
"Have zeee nice dayo."	「祝你有個愉快的一天喲～」
"You! What are you doing back here?!" says the clerk, skipping the foreign language subtitles completely. "You'd better get on with the mission before Dr. Nonookee prevents you from ever missioning again!"	「你！你怎麼跑回這裡來了？！」店員說道，這次徹底跳過了外語字幕。「你最好快去執行任務，不然諾努基博士會讓你再也沒機會執行任何任務！」
"What are you talking about? I've never seen you before in my entire life!" says the dorky-looking guy, "Besides, you're not supposed to talk to me like that before we exchange our cute, little, secret phrases!"	「你在說什麼啊？我這輩子從沒見過你！」那個呆頭呆腦的傢伙說，「而且，我們還沒交換那些可愛的小暗號之前，你不該這樣跟我說話！」
"What do you mean," she responds, "you just walked out that other door over there!"	「你這話什麼意思，」她回答，「你剛才不是才從那邊那扇門走出去嗎！」
"Not me!" he exclaims. "Hey! Wait a minute! Don't tell me you gave the goods to someone else?"	「不是我！」他驚呼道。「嘿！等一下！別告訴我妳把東西給了別人？」
"I, eh, uh," she stammers, "I'm not sure, that is, there may be a... I may have..."	「我、呃、那個，」她結結巴巴地說，「我不確定，也就是說，可能有個……我可能……」
Her voice trembles with fear!	她的聲音因恐懼而顫抖！
"I'm sorry, he fit your description perfectly! And he said the secret code phrases as well!! Although, come to think of it, he DID have a terrible accent. I thought the bad accent might have been part of your disguise."	「對不起，他完全符合你的描述！而且他也說對了暗號句子！！不過，仔細想想，他的口音真的很糟。我還以為那口音可能是你偽裝的一部分呢。」
"What will I do?" she continues, "Dr. Nonookee doesn't tolerate mistakes!"	「我該怎麼辦？」她接著說，「諾努基博士不容許任何失誤！」
Her eyes flash with an idea, "Of course, if you promise to help me, I won't tell him how you lost the microfiche!"	她眼中閃過一個念頭：「當然了，只要你答應幫我，我就不會告訴他你把縮影膠片弄丟的事！」
"Why, you..." he threatens, "if you know what's good for you, you'll shut down this joint, contact Nontoonyt Island, and get the troops started finding this guy. They'll guarantee he tells no tales about your little indiscretion! If you can retrieve the microfiche before he discovers what he has, Dr. Nonookee might even allow you to live a few extra days!"	「你這個……」他威脅道，「妳要是識相，就趕快把這地方關了，聯絡農圖尼特島，派部隊出去找那傢伙。他們保證會讓他把嘴閉緊，不會洩漏妳這點小差錯！要是妳能在他發現手上東西的真相之前把縮影膠片拿回來，諾努基博士說不定還會讓妳多活幾天！」
She deliberates just a moment before making her decision.	她沉思了片刻，才做出決定。
"You're right, of course. You see if you can follow him, while I contact the island by radiotelephone."	「你說得對，沒錯。你去想辦法跟蹤他，我用無線電話聯絡島上。」
Well, Larry, this is certainly another fine mess you've gotten us into!	好啦，賴瑞，你這次又把我們搞進一團大麻煩裡了！
Not only is the KGB after you for grabbing what was supposed to be theirs, but Dr. Nonookee's beautiful army of henchettes, game show hostesses, church secretaries, and bimbos is now hot on your tail!	不只克格勃因為你搶走了本該屬於他們的東西而追殺你，就連諾努基博士那支由美麗女打手、遊戲節目主持女郎、教會女秘書和花瓶美女組成的軍團，現在也緊咬著你不放！
Since we've now learned the worst, we'll rejoin you as you wander through Los Angeles...	既然我們已經知道了最壞的狀況，那就讓我們回到你身邊，繼續看你在洛杉磯四處遊蕩……
You find Latin American women sexy.	你覺得拉丁美洲女人很性感。
"Molto Lira's" sophisticated, computerized, automatic, shoplifting prevention devices keep this door locked while customers carry merchandise for which they have not paid.	「摩多里拉」精密的電腦化自動防竊裝置，會在顧客身上帶著未付款商品時把這扇門鎖住。
"Swimsuits  1/2-PRICE!"	「泳裝五折特賣！」
There is a rack of swimsuits against the rear wall.	後牆邊有一整排泳裝架。
The rest of these suits appear to be too generously cut in the crotch region for a guy like you!	其餘這些泳褲的胯下部位剪裁似乎太「寬敞」了，不適合像你這樣的男人！
There's nothing in this place that you could afford!	這地方沒有一樣東西是你買得起的！
Wait a minute; these swimsuits are marked down to half-price, only $100,000.00. With your new-found wealth, you could afford that little, blue, bikini job hanging there.	等等；這些泳裝打對折特價，只要十萬美元。憑你新到手的財富，你買得起那邊掛著的那件藍色小比基尼。
Never in your life have you seen a man's suit that required a home mortgage!	你這輩子從沒見過一套男裝貴到要辦房貸才買得起！
